{
  "id": "AI_IGNORES_MENU",
  "description": "AI emits no actions while in MENU.",
  "ai_seat": 2,
  "initial": {
    "mode": "MENU",
    "tick": 0,
    "elapsed_time": 0,
    "point_pause_remaining": 0,
    "mode_before_pause": null,
    "ball": { "x": 400, "y": 100, "vx": 300, "vy": 0, "active": false },
    "player1": { "y": 300, "score": 0 },
    "player2": { "y": 300, "score": 0 },
    "serving_player": 1,
    "winner": 0
  },
  "steps": [],
  "expect": {
    "ai_held": []
  }
}
