{
  "id": "GAME_OVER_AT_ELEVEN",
  "description": "Scoring when player1 already has 10 points transitions to GAME_OVER with winner 1.",
  "initial": {
    "mode": "PLAYING",
    "tick": 0,
    "elapsed_time": 0,
    "point_pause_remaining": 0,
    "mode_before_pause": null,
    "ball": { "x": 796, "y": 300, "vx": 300, "vy": 0, "active": true },
    "player1": { "y": 300, "score": 10 },
    "player2": { "y": 40, "score": 3 },
    "serving_player": 1,
    "winner": 0
  },
  "steps": [
    { "held": [], "pressed": [], "repeat": 3 }
  ],
  "expect": {
    "state": {
      "mode": "GAME_OVER",
      "player1": { "score": 11 },
      "winner": 1,
      "ball": { "active": false }
    },
    "events": ["score", "game_over"]
  }
}
