{
  "id": "OPPOSING_INPUTS_CANCEL",
  "description": "P1_UP and P1_DOWN together produce zero net paddle movement.",
  "initial": {
    "mode": "PLAYING",
    "tick": 0,
    "elapsed_time": 0,
    "point_pause_remaining": 0,
    "mode_before_pause": null,
    "ball": { "x": 400, "y": 300, "vx": 0, "vy": 0, "active": true },
    "player1": { "y": 300, "score": 0 },
    "player2": { "y": 300, "score": 0 },
    "serving_player": 1,
    "winner": 0
  },
  "steps": [
    { "held": ["P1_UP", "P1_DOWN"], "pressed": [], "repeat": 30 }
  ],
  "expect": {
    "state": {
      "player1": { "y": 300 }
    }
  }
}
