{
  "id": "PADDLE_MOVE_UP",
  "description": "Holding P1_UP for 1 second moves paddle from 300 to 300-400=-100 clamped to 40.",
  "initial": {
    "mode": "PLAYING",
    "tick": 0,
    "elapsed_time": 0,
    "point_pause_remaining": 0,
    "mode_before_pause": null,
    "ball": { "x": 400, "y": 300, "vx": 0, "vy": 0, "active": true },
    "player1": { "y": 300, "score": 0 },
    "player2": { "y": 300, "score": 0 },
    "serving_player": 1,
    "winner": 0
  },
  "steps": [
    { "held": ["P1_UP"], "pressed": [], "repeat": 60 }
  ],
  "expect": {
    "state": {
      "player1": { "y": 40 },
      "tick": 60
    }
  }
}
